Date,ID,Tweet
2022-07-24 14:53:46+00:00,1551219093025435648,"濃厚接触者になって、明日までの
約1週間休みなんだけど、
結局コロナには感染してなかったみたいで家でぴんぴんしてたし、
やりたいこと好きな時間にできて
仕事にも行ってないから
めっっっちゃストレスフリー🙆‍♀️🌷"
2022-07-24 14:45:21+00:00,1551216975724281858,コロナをはじめとした感染症、戦争などをはじめとした社会情勢が深刻な中、生きてきた境遇で必死に耐えて、よくここまで生きてきた。不安や恐怖は決して減ることなく、この異常なストレス社会で生き抜いていたこと自体自分すごく頑張った。
2022-07-24 14:34:00+00:00,1551214116408557568,明後日、模擬試験だけど体調が今ひとつで夏バテのだるだる。この状態でやっても頭に入らないので疲れた時はぐっすり寝るか。マスクで肌荒れした部位が夏の汗でこじらせてしまってるし試験前のストレスなのかもう10年以上なかった口内炎ができるし免疫力ダダ下がってるけどコロナ感染の気配は皆無。
2022-07-24 14:33:59+00:00,1551214111828361216,"念のためPCR検査を受けたビビビ君は陰性。でも娘は鼻水ズビズビ。抗原検査は陰性だから登園可なんだけど、ホントに行ってもいいのか悩む。。

だぁぁぁ〜コロナが怖いとかよりも、この、休む休まないで悩まなきゃいけない事がストレスだな💨"
2022-07-24 14:30:38+00:00,1551213270526488576,今日でスマートウォッチ（正確にはスマートバンド）買って一週間経って、風呂以外は寝てる時も含め常時装着してるが、心拍数とか歩数とか睡眠データとかストレス値とかをモニタリングしててホンマ面白い。医療用まで正確じゃなかろうが血中酸素濃度も測定できるしコロナ用と考えてもええ買い物やった。
2022-07-24 14:27:49+00:00,1551212560212701184,コロナのせいでストレス溜まってゲームもLINEもしばらく封印すると決めた今日この頃
2022-07-24 14:27:25+00:00,1551212461290065921,"9時間掛りましたが、無事終了😊
桜島噴火したけど、少しでも地球の核のストレスが減少するといいな a 😉
悩みぬいて涙してきた１年間の苦悩にピリオドを打つ時が来ました。自分の人生だから自分んで決めなきゃ🙃
今週もコロナ感染と熱中症対策しながら頑張りましょう💞 https://t.co/nvRvWvVIPq"
2022-07-24 14:13:32+00:00,1551208968671731712,今久々出張から帰宅した嫁の第一声。『え　なんでおるん⁉︎部屋から出てくんなよ💢』　普通は大丈夫やった？とかちゃうの？こっちずっと1人で身の回りのことしててんから部屋にこもるとか不可能やろ。まじ1人の方がストレスフリーやった。コロナうつすぞ…くそ嫁が…呪 https://t.co/vuRtl9RVW8
2022-07-24 14:11:44+00:00,1551208515880222720,今日から25週！3年ぶりの実家で布団が合わなかったりするけど👶は今日も元気そうだしコロナのストレス少し減ったのも良かった！明日の夜は少し歩けるといいなぁ
2022-07-24 14:08:22+00:00,1551207666181353475,因果関係はさだかではないけど、1ヶ月早産したのはストレスによるところが大きいと思うんですよね。産後もストレス与え続けてくれて、先述の「連絡は旦那に」の気まずいやりとりも頭から消え去り、当然のように病院に押しかけようとした。コロナで面会謝絶じゃなかったらと思うとゾッとする。
2022-07-24 14:07:40+00:00,1551207488766504961,コロナ禍で飲食のこと以外はほぼストレスを感じていない(しかもお取り寄せ等で発散)このタヌキ、確かに体重管理は得意💪
2022-07-24 14:02:51+00:00,1551206280131670016,コロナ禍はじまってからストレス解消のための飲食物増えたな
2022-07-24 14:01:24+00:00,1551205914216398849,"愚痴らしてください
マジで旦那無理😫
自宅待機期間ずーっとあーしろこーしろとマジでうるさい😡
あれどうする❓これどうする❓と自分で考えずめんどくさいことは委ねてくるし😡
この息苦しさはコロナの兆候なのかストレスなのか💦
火曜日から仕事復帰する予定なので後1日我慢😡
マジで限界です😡😡😡"
2022-07-24 13:57:07+00:00,1551204834681843713,"我が家3年ぶりに熱出てる。マスク生活始まって病気と無縁やったのに
息子の次は娘。コロナではない今ネットニュースでよく見る「凶悪な風邪」の方RSと思われ私も喉が違和感から痛みへ昇格
１人完全フリーガラ空きの世話係つまり無職旦那がいるからなんとか大丈夫。
ストレスから解放された人間はつおい"
2022-07-24 13:53:31+00:00,1551203928850591744,コロナではないけど風邪の後遺症でキーが6コくらい下がってまともに歌えなくなったのかなりストレス
2022-07-24 13:49:52+00:00,1551203011317608448,"まだコロナかもわからんけどこの土日家にいるだけでほんとストレス( ꒪ͧд꒪ͧ)
旦那と長女は2人で連日お出かけしてるし( ꒪ͧд꒪ͧ)"
2022-07-24 13:47:47+00:00,1551202487352578048,"毎日新聞ニュースからのスクリーンショット。
子供さん達確りコロナから重症化や後遺症から守る事を優先日しませんと、母親が仕事を休むに継り母親が感染したらと連鎖が発生し、社会が麻痺する‼️
親のストレスは凄いと思いますから行政は細かな手当を‼️ https://t.co/TSBVO8hLrX"
2022-07-24 13:47:32+00:00,1551202425398493184,これからって時に趣味初められるの嫌って気持ちももちろん共感するけど、そうは言っても出産まで数ヶ月はあるし普段仕事でストレス感じとるやろうし行動制限のある妊婦に何か求めるよりも外で一人でストレス発散（もちろんコロナ対策はしながら）して解決してくれたほうが有り難いかもなとも思う🤔
2022-07-24 13:46:21+00:00,1551202126231408640,"最近は病院行っても
「ストレスですね」
か
「老化ですね」
しか言われなかったけど、
今度からは
「コロナ後遺症ですね」
とか言われるようになるんだろうか。。

#コロナ後遺症"
2022-07-24 13:43:41+00:00,1551201453150449665,今日はミニオンを観に行ってきました😆✨✨✨可愛かったし楽しかったー✨コロナが怖いので田舎の映画館の夜の部にした大人が多めでした😆皆めちゃわらってた✨体調はまだ完全じゃないけどすごいストレス発散になった😆 https://t.co/crPdBGjfcb
2022-07-24 13:42:22+00:00,1551201122660286464,推しのコロナ感染と就活のストレスと生理が重なってる今、メンタルゴミカスすぎてやべ〜 こんな時にinjが海辺でギター弾いてくれたら情緒おかしくなって泣いちゃうかも……(生理の時に海辺でギター引いてくれる男なんていない)(いる)
2022-07-24 13:41:53+00:00,1551201003294187520,"新型コロナウイルスに感染して、多分一番ストレスのかからない方法。

・症状が出たら家に帰る
・コールドクターなどの往診サービスアプリをスマホにダウンロード
・名前、住所、スマホ電話番号、保険証、クレジットカードを登録
・アプリから往診依頼
↓"
2022-07-24 13:40:06+00:00,1551200554025877506,"は？新規感染者日本が世界1？

マスクもワクチンもどこのお国よりも
やってるはずですが意味なし？

結局、栄養と睡眠とストレス発散で
自分の免疫力上げて立ち向かうしか
道はないのか。

2年半もの間コロナ音頭を
踊らされた気分。"
